"created_at","title","content","Tags","Description"
"2023-01-15","Introduction to Python Lists","Explore the ins and outs of Python lists, a versatile data structure. From basic operations to advanced manipulations, this comprehensive guide covers everything you need to know to harness the power of lists in Python programming.","ARRAY['Python', 'Lists']","A beginner-friendly guide to understanding and using Python lists. Learn how to leverage lists for efficient data storage and manipulation in your Python projects."
"2023-02-02","Building a RESTful API with Node.js","Take a deep dive into creating a RESTful API using Node.js and Express. This step-by-step tutorial covers everything from setting up your project to handling authentication and deploying your API.","ARRAY['Node.js', 'API']","A hands-on tutorial for creating a robust and scalable API with Node.js. Learn best practices for building RESTful APIs and streamline your development workflow."
"2023-03-10","Mastering Git Branching","Delve into the world of Git branching strategies and best practices. From feature branches to Gitflow, this guide empowers you to manage your version control effectively in collaborative software development.","ARRAY['Git', 'Version Control']","Enhance your Git skills by mastering branching workflows and collaboration. This guide provides practical tips and strategies to streamline your version control process."
"2023-04-05","Introduction to Responsive Web Design","Master the art of creating responsive web designs using HTML and CSS. Learn the principles of responsive design and how to implement them to ensure your web pages look great on any device.","ARRAY['Web Development', 'Responsive Design']","Design web pages that adapt seamlessly to various screen sizes and devices. This beginner-friendly guide covers the essential concepts and techniques of responsive web design."
"2023-05-20","Exploring Java Streams","Unlock the full potential of Java Streams for concise and expressive code. This in-depth exploration covers the basics of streams, intermediate operations, and advanced use cases to make your Java code more efficient.","ARRAY['Java', 'Streams']","Simplify your Java code with Streams for efficient and functional programming. This guide provides hands-on examples and tips for leveraging Java Streams effectively."
"2023-06-08","Getting Started with Django Framework","Kickstart your web development journey with Django, a high-level Python web framework. This step-by-step guide covers project setup, MVC architecture, and building dynamic web applications with Django.","ARRAY['Django', 'Web Development']","Create web applications quickly and efficiently using the Django framework. This beginner-friendly tutorial guides you through the essential steps of building web applications with Django."
"2023-07-15","Understanding JavaScript Promises","Demystify asynchronous programming in JavaScript with Promises. This guide covers the basics of Promises, error handling, and practical examples to help you write clean and readable asynchronous code.","ARRAY['JavaScript', 'Promises']","Grasp the concept of Promises to write clean and readable asynchronous code. Learn how to handle asynchronous operations effectively in JavaScript with Promises."
"2023-08-03","Securing APIs with OAuth 2.0","Implement OAuth 2.0 to enhance security in your API authentication process. This guide covers the OAuth 2.0 workflow, token management, and best practices for securing your APIs.","ARRAY['OAuth 2.0', 'Security']","Ensure the security of your APIs by integrating OAuth 2.0 for user authentication. This guide provides a comprehensive overview and practical tips for implementing OAuth 2.0 in your API security strategy."
"2023-09-12","Optimizing SQL Queries for Performance","Optimize your SQL queries for better database performance. This guide covers indexing, query optimization techniques, and best practices to ensure your database queries run efficiently.","ARRAY['SQL', 'Database']","Improve the efficiency of your database queries for faster and scalable applications. This guide provides actionable tips and strategies for optimizing SQL queries and improving overall database performance."
"2023-10-25","Introduction to Containerization with Docker","Explore the fundamentals of containerization using Docker for seamless deployment. This guide covers Docker basics, container orchestration, and practical tips for containerizing your applications.","ARRAY['Docker', 'Containerization']","Containerize your applications for consistent and efficient deployment across different environments. This beginner-friendly guide covers the essentials of Docker and how containerization can simplify your application deployment process."
